{
  "metric_id": "660e8400-e29b-41d4-a716-446655440001",
  "generated_at": "2024-07-05T10:30:00Z",
  "period": "daily",
  "time_window": {
    "start": "2024-07-05T00:00:00Z",
    "end": "2024-07-05T23:59:59Z"
  },
  "total_repos": 12,
  "total_predictions": 156,
  "avg_precision": 0.823,
  "avg_recall": 0.912,
  "avg_f1": 0.865,
  "improvement_over_time": [
    {
      "checkpoint": "2024-07-01T00:00:00Z",
      "avg_f1": 0.742
    },
    {
      "checkpoint": "2024-07-02T00:00:00Z",
      "avg_f1": 0.768
    },
    {
      "checkpoint": "2024-07-03T00:00:00Z",
      "avg_f1": 0.801
    },
    {
      "checkpoint": "2024-07-04T00:00:00Z",
      "avg_f1": 0.838
    },
    {
      "checkpoint": "2024-07-05T00:00:00Z",
      "avg_f1": 0.865
    }
  ],
  "percentiles": {
    "p50_f1": 0.872,
    "p75_f1": 0.918,
    "p90_f1": 0.952,
    "p95_f1": 0.968
  }
}
